{
    "schema_version": 1,
    "key": "peanut.oauth",
    "version": "1.0.4",
    "source": {
        "type": "canonical-contents",
        "reference": "canonical-plugin-contents-v1",
        "sha256": "2f5e3a51b296eb2bb6364c7f5d35bb8e7a87b2f3101891e2ad5eb70df17abf60"
    },
    "trust": {
        "channel": "bundled",
        "origin": {
            "type": "repository-contents",
            "reference": "canonical-plugin-contents-v1"
        },
        "archive": {
            "status": "not-issued",
            "sha256": null
        },
        "signature": {
            "status": "not-issued",
            "key_id": null
        },
        "sbom": {
            "status": "not-issued",
            "sha256": null
        },
        "license": {
            "identifier": "Apache-2.0",
            "status": "declared"
        },
        "qualification": {
            "status": "bundled-locked",
            "review": "not-reviewed",
            "vulnerability_response": "not-configured",
            "marketplace": "blocked"
        },
        "compatibility": {
            "modules": [
                {
                    "key": "peanut.oauth",
                    "version": "1.0.4",
                    "kernel_constraint": "^1.0",
                    "dependencies": [
                        {
                            "module_key": "peanut.file",
                            "version": "^1.0"
                        },
                        {
                            "module_key": "peanut.integration",
                            "version": "^1.0"
                        },
                        {
                            "module_key": "peanut.member",
                            "version": "^1.0"
                        },
                        {
                            "module_key": "peanut.notification",
                            "version": "^1.0"
                        },
                        {
                            "module_key": "peanut.settings",
                            "version": "^1.0"
                        }
                    ],
                    "permissions": {
                        "path": "resources/permissions.json",
                        "sha256": "6bdcf50db198120d9f87cd5cef0e738f5b82b126e89875c11c396e0761c9b829"
                    }
                }
            ]
        }
    },
    "composer": [
        {
            "name": "peanut-business/peanut-oauth",
            "version": "1.0.4",
            "sha256": "92accd1b5fe97399454508e829969b49b65d0d19356b861918a98dd4158a4088"
        }
    ],
    "npm": [
        {
            "name": "@peanut-admin/peanut-oauth",
            "version": "1.0.1",
            "integrity": "sha256-jhcJoC8cHxp9yzEEottIxywQ+o4XIrfKqcDzprY+AVw="
        }
    ],
    "frontend": [
        {
            "client_key": "admin-web",
            "package": "@peanut-admin/peanut-oauth",
            "version": "1.0.1",
            "entry": "web/src/modules/peanut-oauth/contribution.ts",
            "sha256": "310b168a7c225099382b1d540324d8680acdfe7dddcb05a0b05ef8d3876bc632"
        }
    ],
    "modules": [
        {
            "key": "peanut.oauth",
            "root": "server/app/modules/peanut/oauth"
        }
    ]
}
