{
    "schema_version": 1,
    "key": "peanut.content-tools",
    "version": "1.0.1",
    "source": {
        "type": "canonical-contents",
        "reference": "canonical-plugin-contents-v1",
        "sha256": "f17f626c64a5de522933206c8fa2a99b19bc4ad0338895aa487b394ff7d3f8ce"
    },
    "trust": {
        "channel": "bundled",
        "origin": {
            "type": "repository-contents",
            "reference": "canonical-plugin-contents-v1"
        },
        "archive": {
            "status": "not-issued",
            "sha256": null
        },
        "signature": {
            "status": "not-issued",
            "key_id": null
        },
        "sbom": {
            "status": "not-issued",
            "sha256": null
        },
        "license": {
            "identifier": "Apache-2.0",
            "status": "declared"
        },
        "qualification": {
            "status": "bundled-locked",
            "review": "not-reviewed",
            "vulnerability_response": "not-configured",
            "marketplace": "blocked"
        },
        "compatibility": {
            "modules": [
                {
                    "key": "peanut.content-tools",
                    "version": "1.0.1",
                    "kernel_constraint": "^1.0",
                    "dependencies": [],
                    "permissions": {
                        "path": "resources/permissions.json",
                        "sha256": "37517e5f3dc66819f61f5a7bb8ace1921282415f10551d2defa5c3eb0985b570"
                    }
                }
            ]
        }
    },
    "composer": [
        {
            "name": "peanut-business/peanut-content-tools",
            "version": "1.0.1",
            "sha256": "7a5f955f6063b392891aea2402041709400bc760c247525e0de2e91b523e857b"
        }
    ],
    "npm": [
        {
            "name": "@peanut-admin/peanut-content-tools",
            "version": "1.0.0",
            "integrity": "sha256-089YfGwAQ/k1nWWfqYhk6sLGHDmS7jWMcWY0R2bDTY4="
        }
    ],
    "frontend": [
        {
            "client_key": "admin-web",
            "package": "@peanut-admin/peanut-content-tools",
            "version": "1.0.0",
            "entry": "web/src/modules/peanut-content-tools/contribution.ts",
            "sha256": "d5dd0c457b9623a506140ebaaa0d75620ae975d497050a3f1c5fd2bbf235ad38"
        }
    ],
    "modules": [
        {
            "key": "peanut.content-tools",
            "root": "server/app/modules/peanut/content_tools"
        }
    ]
}
