{
    "schema_version": 1,
    "key": "fixture.delivery-record",
    "version": "1.0.0",
    "source": {
        "type": "canonical-contents",
        "reference": "canonical-plugin-contents-v1",
        "sha256": "07dd55bd70c428131c275ee954309e7057898ab2ea181ef026f9fb8e82f9702d"
    },
    "trust": {
        "channel": "bundled",
        "origin": {
            "type": "repository-contents",
            "reference": "canonical-plugin-contents-v1"
        },
        "archive": {
            "status": "not-issued",
            "sha256": null
        },
        "signature": {
            "status": "not-issued",
            "key_id": null
        },
        "sbom": {
            "status": "not-issued",
            "sha256": null
        },
        "license": {
            "identifier": "Apache-2.0",
            "status": "declared"
        },
        "qualification": {
            "status": "bundled-locked",
            "review": "not-reviewed",
            "vulnerability_response": "not-configured",
            "marketplace": "blocked"
        },
        "compatibility": {
            "modules": [
                {
                    "key": "fixture.delivery-record",
                    "version": "1.0.0",
                    "kernel_constraint": "^1.0",
                    "dependencies": [],
                    "permissions": {
                        "path": "resources/permissions.json",
                        "sha256": "b182a0e7a16b5afd72afb1700551818252f26e1cdb7ae4f6f0fe93231025adfe"
                    }
                }
            ]
        }
    },
    "composer": [
        {
            "name": "peanut-business/fixture-delivery-record",
            "version": "1.0.0",
            "sha256": "818495400405f232d66524bcb95684cb57a4adbdd6ee4ac64a2905625872fdff"
        }
    ],
    "npm": [
        {
            "name": "@peanut-admin/fixture-delivery-record",
            "version": "1.0.0",
            "integrity": "sha256-QcAVCuXkfgGZ9z7/7nuJ7b/orjkxRyEwvAosm3wenQY="
        }
    ],
    "frontend": [
        {
            "client_key": "admin-web",
            "package": "@peanut-admin/fixture-delivery-record",
            "version": "1.0.0",
            "entry": "web/src/modules/fixture-delivery-record/contribution.ts",
            "sha256": "6c4a51c1387e98b207dc5de6d75c72a9778c777c0a9ed91376e4490110a9f5bb"
        }
    ],
    "modules": [
        {
            "key": "fixture.delivery-record",
            "root": "server/app/modules/fixture/delivery_record"
        }
    ]
}
