{
    "schema_version": 1,
    "key": "peanut.document",
    "version": "1.0.9",
    "source": {
        "type": "canonical-contents",
        "reference": "canonical-plugin-contents-v1",
        "sha256": "7dcfd46c7adcfb31590854c128a69f96a72e9bcfb54ac4f28d73016fd22a3463"
    },
    "trust": {
        "channel": "bundled",
        "origin": {
            "type": "repository-contents",
            "reference": "canonical-plugin-contents-v1"
        },
        "archive": {
            "status": "not-issued",
            "sha256": null
        },
        "signature": {
            "status": "not-issued",
            "key_id": null
        },
        "sbom": {
            "status": "not-issued",
            "sha256": null
        },
        "license": {
            "identifier": "Apache-2.0",
            "status": "declared"
        },
        "qualification": {
            "status": "bundled-locked",
            "review": "not-reviewed",
            "vulnerability_response": "not-configured",
            "marketplace": "blocked"
        },
        "compatibility": {
            "modules": [
                {
                    "key": "peanut.document",
                    "version": "1.0.9",
                    "kernel_constraint": "^1.0",
                    "dependencies": [
                        {
                            "module_key": "peanut.content-tools",
                            "version": "1.0.1"
                        },
                        {
                            "module_key": "peanut.file",
                            "version": "^1.0"
                        },
                        {
                            "module_key": "peanut.identity",
                            "version": "4.0.0-rc.31"
                        },
                        {
                            "module_key": "peanut.rich-text",
                            "version": "^1.0"
                        }
                    ],
                    "permissions": {
                        "path": "resources/permissions.json",
                        "sha256": "37517e5f3dc66819f61f5a7bb8ace1921282415f10551d2defa5c3eb0985b570"
                    }
                }
            ]
        }
    },
    "composer": [
        {
            "name": "peanut-business/peanut-document",
            "version": "1.0.9",
            "sha256": "890aa55f7c75b73f70d959d3da605aeb5d6986ec2dea953faf9cb4ce298e8513"
        }
    ],
    "npm": [
        {
            "name": "@peanut-admin/peanut-document",
            "version": "1.0.1",
            "integrity": "sha256-5L6jZm3A/ZC4E8Buibl1z7RGx3tijEpxSIwmTm0RcIs="
        }
    ],
    "frontend": [
        {
            "client_key": "admin-web",
            "package": "@peanut-admin/peanut-document",
            "version": "1.0.1",
            "entry": "web/src/modules/peanut-document/contribution.ts",
            "sha256": "117de206df4ea1e533b8b8e73eb635e779c86c4a22a2d8680aff23e12bde6cd2"
        }
    ],
    "modules": [
        {
            "key": "peanut.document",
            "root": "server/app/modules/peanut/document"
        }
    ]
}
