{
    "schema_version": 1,
    "key": "official.article",
    "version": "1.0.8",
    "source": {
        "type": "canonical-contents",
        "reference": "canonical-plugin-contents-v1",
        "sha256": "224a89ed3ad63e56473740e9a2f8b2ea29197b5eb0f09a611d905d7d38c21ac3"
    },
    "trust": {
        "channel": "bundled",
        "origin": {
            "type": "repository-contents",
            "reference": "canonical-plugin-contents-v1"
        },
        "archive": {
            "status": "not-issued",
            "sha256": null
        },
        "signature": {
            "status": "not-issued",
            "key_id": null
        },
        "sbom": {
            "status": "not-issued",
            "sha256": null
        },
        "license": {
            "identifier": "Apache-2.0",
            "status": "declared"
        },
        "qualification": {
            "status": "bundled-locked",
            "review": "not-reviewed",
            "vulnerability_response": "not-configured",
            "marketplace": "blocked"
        },
        "compatibility": {
            "modules": [
                {
                    "key": "official.article",
                    "version": "1.0.8",
                    "kernel_constraint": "^1.0",
                    "dependencies": [
                        {
                            "module_key": "official.document",
                            "version": "^1.0"
                        },
                        {
                            "module_key": "official.file",
                            "version": "^1.0"
                        },
                        {
                            "module_key": "official.rich-text",
                            "version": "^1.0"
                        }
                    ],
                    "permissions": {
                        "path": "resources/permissions.json",
                        "sha256": "c1f2aeea64aba642a66e4b8542ee570e018ad53866cbff662d4a5cf57bfcf5ca"
                    }
                }
            ]
        }
    },
    "composer": [
        {
            "name": "peanut-business/official-article",
            "version": "1.0.4",
            "sha256": "6c0301588f96df9fa4647a108ad5e92f24e9176a098614420a4d5cf3709f9847"
        }
    ],
    "npm": [
        {
            "name": "@peanut-admin/official-article",
            "version": "1.0.4",
            "integrity": "sha256-VSC/OM4Gua0ediXl7+kLHe9iTNGF0mjDLFaSvIkr3T4="
        }
    ],
    "frontend": [
        {
            "client_key": "admin-web",
            "package": "@peanut-admin/official-article",
            "version": "1.0.4",
            "entry": "web/src/modules/official-article/contribution.ts",
            "sha256": "c4c715937dd643e5014d3218db515e98eca49a049c7cc47465c3abc370dd0486"
        }
    ],
    "modules": [
        {
            "key": "official.article",
            "root": "server/app/modules/official/article"
        }
    ]
}
