{
    "schema_version": 1,
    "key": "peanut.collaboration",
    "version": "1.0.10",
    "source": {
        "type": "canonical-contents",
        "reference": "canonical-plugin-contents-v1",
        "sha256": "5b0c8c84decbd1c9e571902d90bc70bc076539688070671b2058725bd8539359"
    },
    "trust": {
        "channel": "bundled",
        "origin": {
            "type": "repository-contents",
            "reference": "canonical-plugin-contents-v1"
        },
        "archive": {
            "status": "not-issued",
            "sha256": null
        },
        "signature": {
            "status": "not-issued",
            "key_id": null
        },
        "sbom": {
            "status": "not-issued",
            "sha256": null
        },
        "license": {
            "identifier": "Apache-2.0",
            "status": "declared"
        },
        "qualification": {
            "status": "bundled-locked",
            "review": "not-reviewed",
            "vulnerability_response": "not-configured",
            "marketplace": "blocked"
        },
        "compatibility": {
            "modules": [
                {
                    "key": "peanut.collaboration",
                    "version": "1.0.10",
                    "kernel_constraint": "^1.0",
                    "dependencies": [
                        {
                            "module_key": "peanut.document",
                            "version": "^1.0.2"
                        },
                        {
                            "module_key": "peanut.file",
                            "version": "^1.0"
                        },
                        {
                            "module_key": "peanut.identity",
                            "version": "4.0.0-rc.32"
                        },
                        {
                            "module_key": "peanut.rich-text",
                            "version": "^1.0"
                        }
                    ],
                    "permissions": {
                        "path": "resources/permissions.json",
                        "sha256": "37517e5f3dc66819f61f5a7bb8ace1921282415f10551d2defa5c3eb0985b570"
                    }
                }
            ]
        }
    },
    "composer": [
        {
            "name": "peanut-business/peanut-collaboration",
            "version": "1.0.10",
            "sha256": "9f1aa5cd637a6e91cb4c7fef6ac64f51345753141a0959ea18f601009e668235"
        }
    ],
    "npm": [],
    "frontend": [],
    "modules": [
        {
            "key": "peanut.collaboration",
            "root": "server/app/modules/peanut/collaboration"
        }
    ]
}
