{
    "schema_version": 1,
    "key": "peanut.settings",
    "version": "1.0.24",
    "source": {
        "type": "canonical-contents",
        "reference": "canonical-plugin-contents-v1",
        "sha256": "ce4315565c82f776a767652a3bfa2ed31b74ce7d47ee046b66dc392133a7fa12"
    },
    "trust": {
        "channel": "bundled",
        "origin": {
            "type": "repository-contents",
            "reference": "canonical-plugin-contents-v1"
        },
        "archive": {
            "status": "not-issued",
            "sha256": null
        },
        "signature": {
            "status": "not-issued",
            "key_id": null
        },
        "sbom": {
            "status": "not-issued",
            "sha256": null
        },
        "license": {
            "identifier": "Apache-2.0",
            "status": "declared"
        },
        "qualification": {
            "status": "bundled-locked",
            "review": "not-reviewed",
            "vulnerability_response": "not-configured",
            "marketplace": "blocked"
        },
        "compatibility": {
            "modules": [
                {
                    "key": "peanut.settings",
                    "version": "1.0.24",
                    "kernel_constraint": "^1.0",
                    "dependencies": [
                        {
                            "module_key": "peanut.file",
                            "version": "^1.0"
                        },
                        {
                            "module_key": "peanut.identity",
                            "version": "^4.0.0-rc.32"
                        }
                    ],
                    "permissions": {
                        "path": "resources/permissions.json",
                        "sha256": "935c176d2b298915a870e5eeb7e33fea2205cb9a86bb5e687a270d175765a989"
                    }
                }
            ]
        }
    },
    "composer": [
        {
            "name": "peanut-business/peanut-settings",
            "version": "1.0.24",
            "sha256": "4f31616855b11dcb0d40902c9d2914cc6caa5ed1fbebf8023429f3c3f12c2c9e"
        }
    ],
    "npm": [
        {
            "name": "@peanut-admin/peanut-settings",
            "version": "1.0.5",
            "integrity": "sha256-k8He3QbvDtQiirgpLvIN3yt7ZraIk/D9KmHdesaXcm4="
        }
    ],
    "frontend": [
        {
            "client_key": "admin-web",
            "package": "@peanut-admin/peanut-settings",
            "version": "1.0.5",
            "entry": "web/src/modules/peanut-settings/contribution.ts",
            "sha256": "ed8bd50f813af4a0d4a74c600dd0446a185027f299b3c4a9f39f858daee2e173"
        }
    ],
    "modules": [
        {
            "key": "peanut.settings",
            "root": "server/app/modules/peanut/settings"
        }
    ]
}
