{
    "schema_version": 1,
    "key": "peanut.integration",
    "version": "1.0.26",
    "source": {
        "type": "canonical-contents",
        "reference": "canonical-plugin-contents-v1",
        "sha256": "67863bcf5fa7af02b0203b8b96351d51cb8f3ea7d1d435b5210330caf1c39198"
    },
    "trust": {
        "channel": "bundled",
        "origin": {
            "type": "repository-contents",
            "reference": "canonical-plugin-contents-v1"
        },
        "archive": {
            "status": "not-issued",
            "sha256": null
        },
        "signature": {
            "status": "not-issued",
            "key_id": null
        },
        "sbom": {
            "status": "not-issued",
            "sha256": null
        },
        "license": {
            "identifier": "Apache-2.0",
            "status": "declared"
        },
        "qualification": {
            "status": "bundled-locked",
            "review": "not-reviewed",
            "vulnerability_response": "not-configured",
            "marketplace": "blocked"
        },
        "compatibility": {
            "modules": [
                {
                    "key": "peanut.integration",
                    "version": "1.0.26",
                    "kernel_constraint": "^1.0",
                    "dependencies": [
                        {
                            "module_key": "peanut.identity",
                            "version": "^4.0.0-rc.32"
                        }
                    ],
                    "permissions": {
                        "path": "resources/permissions.json",
                        "sha256": "d9b5927ee4f45c24b1a848f3fc3025a4a376a13bbc65110c864e2164c8a2150d"
                    }
                }
            ]
        }
    },
    "composer": [
        {
            "name": "peanut-business/peanut-integration",
            "version": "1.0.26",
            "sha256": "98fdf7cbf29427c16f412497e36ba55695bc9f3365c9c53cd8062a4be3ab8f63"
        }
    ],
    "npm": [
        {
            "name": "@peanut-admin/peanut-integration",
            "version": "1.0.4",
            "integrity": "sha256-BByO+IxOiiEnOPyINYRD/kzAkR4vv1DFN3sgJi10/Xw="
        }
    ],
    "frontend": [
        {
            "client_key": "admin-web",
            "package": "@peanut-admin/peanut-integration",
            "version": "1.0.4",
            "entry": "web/src/modules/peanut-integration/contribution.ts",
            "sha256": "6474af9b7ee5bad9ae33a1141f7cc48c56e07d478511868b76c8362b1cad53f0"
        }
    ],
    "modules": [
        {
            "key": "peanut.integration",
            "root": "server/app/modules/peanut/integration"
        }
    ]
}
