{
    "schema_version": 1,
    "key": "peanut.member",
    "version": "1.0.19",
    "source": {
        "type": "canonical-contents",
        "reference": "canonical-plugin-contents-v1",
        "sha256": "68c0f685311f3eb6c7162733d812ebbbff110239b5a2803f60ac7cc1561c8637"
    },
    "trust": {
        "channel": "bundled",
        "origin": {
            "type": "repository-contents",
            "reference": "canonical-plugin-contents-v1"
        },
        "archive": {
            "status": "not-issued",
            "sha256": null
        },
        "signature": {
            "status": "not-issued",
            "key_id": null
        },
        "sbom": {
            "status": "not-issued",
            "sha256": null
        },
        "license": {
            "identifier": "Apache-2.0",
            "status": "declared"
        },
        "qualification": {
            "status": "bundled-locked",
            "review": "not-reviewed",
            "vulnerability_response": "not-configured",
            "marketplace": "blocked"
        },
        "compatibility": {
            "modules": [
                {
                    "key": "peanut.member",
                    "version": "1.0.19",
                    "kernel_constraint": "^1.0",
                    "dependencies": [
                        {
                            "module_key": "peanut.file",
                            "version": "^1.0"
                        },
                        {
                            "module_key": "peanut.identity",
                            "version": "4.0.0-rc.32"
                        },
                        {
                            "module_key": "peanut.settings",
                            "version": "^1.0"
                        }
                    ],
                    "permissions": {
                        "path": "resources/permissions.json",
                        "sha256": "a7afde9845c6c7ff95165c486c8f2e29a18cc616998079a4892fcddf611ba1ec"
                    }
                }
            ]
        }
    },
    "composer": [
        {
            "name": "peanut-business/peanut-member",
            "version": "1.0.19",
            "sha256": "f328db390a2cec451fcb765f25891cd524db190167d1cb591f03a715c5e7a73b"
        }
    ],
    "npm": [
        {
            "name": "@peanut-admin/peanut-member",
            "version": "1.0.3",
            "integrity": "sha256-aFajEDBBNudLeh9dxyWHXEkN+bVG+c5fuH+Mnkv5VS0="
        },
        {
            "name": "@peanut-admin/peanut-member-pc",
            "version": "1.0.0",
            "integrity": "sha256-iNh2L+HXIsFpyv2bMNzK5VaSbX/PoTLUBJWkDeHs4Gc="
        },
        {
            "name": "@peanut-admin/peanut-member-uniapp",
            "version": "1.0.0",
            "integrity": "sha256-grwAh8m52w9kGiu4ueLIW40IhysFXLD5jl4CFMZNrsg="
        }
    ],
    "frontend": [
        {
            "client_key": "pc-web",
            "package": "@peanut-admin/peanut-member-pc",
            "version": "1.0.0",
            "entry": "pc/modules/peanut-member/contribution.ts",
            "sha256": "7b4ef293b6db32eda6cb988be84d801534c3b53538f2616ba7fe858d157d44f2"
        },
        {
            "client_key": "uniapp",
            "package": "@peanut-admin/peanut-member-uniapp",
            "version": "1.0.0",
            "entry": "uniapp/src/modules/peanut-member/contribution.ts",
            "sha256": "31fd90daec8604d87032c5ffa68ec1e3246c429d874ef5f2c614b8a56d8ad3d2"
        },
        {
            "client_key": "admin-web",
            "package": "@peanut-admin/peanut-member",
            "version": "1.0.3",
            "entry": "web/src/modules/peanut-member/contribution.ts",
            "sha256": "88a8fd730cba3e0a673fed39a5516797cf1e03bcf3bc3bc3a21ec4730289d58a"
        }
    ],
    "modules": [
        {
            "key": "peanut.member",
            "root": "server/app/modules/peanut/member"
        }
    ]
}
